{"$schema":"https://json-schema.org/draft/2020-12/schema","additionalProperties":false,"properties":{"authority_id":{"minLength":1,"type":"string"},"authority_type":{"const":"authorization_state"},"domains":{"additionalProperties":false,"properties":{"automated_paper_trading":{"const":"WITHHELD"},"baseline_capture":{"const":"WITHHELD"},"bucket_0_completion":{"const":"WITHHELD"},"bucket_1_work":{"const":"WITHHELD"},"canonical_incorporation":{"const":"WITHHELD"},"deployment":{"const":"WITHHELD"},"live_money_trading":{"const":"WITHHELD"},"merge":{"const":"WITHHELD"},"nq_cutover":{"const":"WITHHELD"},"operational_capture_script":{"const":"WITHHELD"},"phase_3c1_r11_acceptance":{"const":"WITHHELD"},"phase_3c2":{"const":"WITHHELD"},"production_implementation":{"const":"WITHHELD"},"runtime_migration":{"const":"WITHHELD"},"service_restart":{"const":"WITHHELD"}},"required":["automated_paper_trading","baseline_capture","bucket_0_completion","bucket_1_work","canonical_incorporation","deployment","live_money_trading","merge","nq_cutover","operational_capture_script","phase_3c1_r11_acceptance","phase_3c2","production_implementation","runtime_migration","service_restart"],"type":"object"},"schema_version":{"const":"6.0.0-DRAFT"}},"required":["authority_id","authority_type","domains","schema_version"],"title":"R4 authorization state","type":"object"}
