{"authority_id":"RANDLE-R4-AUTHORIZATION-STATE-1","authority_type":"authorization_state","domains":{"automated_paper_trading":"WITHHELD","baseline_capture":"WITHHELD","bucket_0_completion":"WITHHELD","bucket_1_work":"WITHHELD","canonical_incorporation":"WITHHELD","deployment":"WITHHELD","live_money_trading":"WITHHELD","merge":"WITHHELD","nq_cutover":"WITHHELD","operational_capture_script":"WITHHELD","phase_3c1_r11_acceptance":"WITHHELD","phase_3c2":"WITHHELD","production_implementation":"WITHHELD","runtime_migration":"WITHHELD","service_restart":"WITHHELD"},"schema_version":"6.0.0-DRAFT"}
